{
  "$schema": "http://json-schema.org/draft-07/schema#",
  "$id": "https://fluencytracr/contracts/evidence-bundle/v1/evidence-bundle.schema.json",
  "title": "EvidenceBundle v1",
  "type": "object",
  "additionalProperties": false,
  "required": [
    "schema_version",
    "org_id",
    "window",
    "generated_at",
    "suppression",
    "coverage",
    "exposure",
    "calibration",
    "fragility",
    "learning"
  ],
  "properties": {
    "schema_version": {
      "type": "string",
      "const": "evidence_bundle.v1"
    },
    "org_id": {
      "type": "string",
      "minLength": 1
    },
    "window": {
      "type": "string",
      "enum": ["daily", "weekly", "30d", "60d"]
    },
    "generated_at": {
      "type": "string",
      "format": "date-time"
    },
    "suppression": {
      "type": "object",
      "additionalProperties": false,
      "required": ["k_min", "suppression_applied", "suppression_reasons"],
      "properties": {
        "k_min": {
          "type": "integer",
          "minimum": 1,
          "maximum": 1000000
        },
        "suppression_applied": {
          "type": "boolean"
        },
        "suppression_reasons": {
          "type": "array",
          "items": {
            "type": "string",
            "enum": [
              "k_min_threshold",
              "irreducible_aggregation",
              "exec_mode_no_org_structure_slice",
              "insufficient_population",
              "privacy_policy_guardrail"
            ]
          },
          "uniqueItems": true
        }
      },
      "allOf": [
        {
          "if": {
            "properties": {
              "suppression_applied": { "const": true }
            },
            "required": ["suppression_applied"]
          },
          "then": {
            "properties": {
              "suppression_reasons": {
                "minItems": 1
              }
            }
          }
        }
      ]
    },
    "coverage": {
      "type": "object",
      "additionalProperties": false,
      "required": ["instrumented_sources", "missing_sources", "coverage_notes"],
      "properties": {
        "instrumented_sources": {
          "type": "array",
          "items": { "type": "string", "minLength": 1 },
          "uniqueItems": true
        },
        "missing_sources": {
          "type": "array",
          "items": { "type": "string", "minLength": 1 },
          "uniqueItems": true
        },
        "coverage_notes": {
          "type": "string",
          "maxLength": 2000
        }
      }
    },
    "exposure": {
      "type": "object",
      "additionalProperties": false,
      "required": ["shadow_ai", "unsanctioned_tool_class"],
      "properties": {
        "shadow_ai": { "$ref": "#/$defs/signal_observation" },
        "unsanctioned_tool_class": { "$ref": "#/$defs/signal_observation" }
      }
    },
    "calibration": {
      "type": "object",
      "additionalProperties": false,
      "required": [
        "verification_presence",
        "recovery_presence",
        "escalation_to_safe_path_presence"
      ],
      "properties": {
        "verification_presence": { "$ref": "#/$defs/signal_observation" },
        "recovery_presence": { "$ref": "#/$defs/signal_observation" },
        "escalation_to_safe_path_presence": { "$ref": "#/$defs/signal_observation" }
      }
    },
    "fragility": {
      "type": "object",
      "additionalProperties": false,
      "required": [
        "friction_loops_elevated",
        "rapid_abandonment_elevated",
        "blind_acceptance_risk_elevated"
      ],
      "properties": {
        "friction_loops_elevated": { "$ref": "#/$defs/signal_observation" },
        "rapid_abandonment_elevated": { "$ref": "#/$defs/signal_observation" },
        "blind_acceptance_risk_elevated": { "$ref": "#/$defs/signal_observation" }
      }
    },
    "learning": {
      "type": "object",
      "additionalProperties": false,
      "required": ["trend_direction"],
      "properties": {
        "trend_direction": {
          "type": "string",
          "enum": ["improving", "stable", "degrading", "suppressed", "not_computed"]
        }
      }
    }
  },
  "$defs": {
    "evidence_status": {
      "type": "string",
      "enum": ["present", "not_present", "suppressed", "not_computed"]
    },
    "bounded_aggregates": {
      "type": "object",
      "additionalProperties": false,
      "properties": {
        "sample_count": {
          "type": "integer",
          "minimum": 0,
          "maximum": 1000000
        },
        "fraction": {
          "type": "number",
          "minimum": 0,
          "maximum": 1
        },
        "numerator": {
          "type": "integer",
          "minimum": 0,
          "maximum": 1000000
        },
        "denominator": {
          "type": "integer",
          "minimum": 1,
          "maximum": 1000000
        }
      }
    },
    "signal_observation": {
      "anyOf": [
        { "$ref": "#/$defs/evidence_status" },
        {
          "type": "object",
          "additionalProperties": false,
          "required": ["status"],
          "properties": {
            "status": { "$ref": "#/$defs/evidence_status" },
            "aggregates": { "$ref": "#/$defs/bounded_aggregates" }
          }
        }
      ]
    }
  }
}
