{
  "schema_version": "evidence_bundle.v1",
  "org_id": "org_enterprise_alpha",
  "window": "30d",
  "generated_at": "2026-02-21T18:30:00Z",
  "suppression": {
    "k_min": 30,
    "suppression_applied": false,
    "suppression_reasons": []
  },
  "coverage": {
    "instrumented_sources": [
      "workspace_telemetry",
      "llm_gateway_events",
      "review_workflow_audit"
    ],
    "missing_sources": [
      "unsanctioned_browser_extension_signals"
    ],
    "coverage_notes": "Coverage map includes human and agentic producer streams."
  },
  "exposure": {
    "shadow_ai": {
      "status": "present",
      "aggregates": {
        "sample_count": 140,
        "fraction": 0.21
      }
    },
    "unsanctioned_tool_class": {
      "status": "not_present",
      "aggregates": {
        "sample_count": 140,
        "numerator": 0,
        "denominator": 140
      }
    }
  },
  "calibration": {
    "verification_presence": {
      "status": "present",
      "aggregates": {
        "sample_count": 96,
        "fraction": 0.69
      }
    },
    "recovery_presence": "present",
    "escalation_to_safe_path_presence": {
      "status": "present",
      "aggregates": {
        "sample_count": 25,
        "fraction": 0.18
      }
    }
  },
  "fragility": {
    "friction_loops_elevated": "not_present",
    "rapid_abandonment_elevated": {
      "status": "not_present",
      "aggregates": {
        "sample_count": 62,
        "fraction": 0.05
      }
    },
    "blind_acceptance_risk_elevated": {
      "status": "present",
      "aggregates": {
        "sample_count": 62,
        "fraction": 0.14
      }
    }
  },
  "learning": {
    "trend_direction": "stable"
  }
}
